{
  "schema_version": "2.4",
  "case_id": "CASE-V24-EXAMPLE",
  "binding": {
    "repository": "owner/example",
    "base_sha": "09cb4fbed2f69b7129ec44770ba9838208cef70e",
    "head_sha": "a89d41619cac11b8195f76b93b3598b99eca9edf",
    "pr_number": null,
    "work_unit": "WU-V24-EXAMPLE"
  },
  "sensor": {
    "evidence_digest": "1c83bdc4ea48aeaa692505bb0820a285b8c477354aa29cd55c169d2d11e37de8",
    "quality_class": "HEURISTIC",
    "trusted_for_gate": true
  },
  "stages": [
    {
      "level": "L1",
      "result_ref": "l1-review.json",
      "result_digest": "228f6341346eaeaaae2393a8a5981bb7a8e4f775584ef04eb5b428b3c107b7c3",
      "verdict": "PASS",
      "confidence": "high"
    },
    {
      "level": "L2",
      "result_ref": "l2-review.json",
      "result_digest": "e349f88c0daa143dbabaae4ddae423daa530765b3b7c23b1f5c02a99b63f9d77",
      "verdict": "FINDINGS",
      "confidence": "high"
    }
  ],
  "required_level": "ADVERSARIAL",
  "achieved_level": "L2",
  "state": "ADVERSARIAL_REQUIRED",
  "gate_conclusion": "action_required",
  "escalation_reasons": [
    "ADVERSARIAL:l1_l2_disagreement",
    "L1_L2_DISAGREEMENT",
    "L2:supply_chain_change"
  ],
  "current_head_verified": true,
  "execution_mode": "SHADOW",
  "gate_effective": false,
  "evidence_git_verified": true,
  "evidence_recomputed_verified": true,
  "worktree_clean_verified": true,
  "ledger_anchor_verified": true,
  "cycle_digest": "08cf30cce836fc71e55b1d3a968f23978c1a401f16556d58da71d524ec34e76f"
}
