{
  "schema_version": "2.4",
  "case_id": "V25-FINAL-STABLE",
  "binding": {
    "repository": "local/GitHub_PR_Review_Harness",
    "base_sha": "37846aaade651c6540c2a9cc1a99c27684514a3b",
    "head_sha": "864ef63404f3b9997ce123a661afdf0a8056efc8",
    "pr_number": null,
    "work_unit": "V25-FINAL"
  },
  "sensor": {
    "evidence_digest": "44f1e9d285173ac62109c2f32fc696319a21478a65ea5232bec63b87a298432b",
    "quality_class": "HEURISTIC",
    "trusted_for_gate": true
  },
  "stages": [
    {
      "level": "L1",
      "result_ref": "l1-review.json",
      "result_digest": "0a066ea082ee271c2475861c7a7f34b0430f1832f7fcc10b58c4407775704849",
      "verdict": "PASS",
      "confidence": "high"
    },
    {
      "level": "L2",
      "result_ref": "l2-review.json",
      "result_digest": "c82bc071dc725b3d557b7d06823c71df851db3d17628c01f2cdf5c5b08f5f820",
      "verdict": "PASS",
      "confidence": "high"
    },
    {
      "level": "ADVERSARIAL",
      "result_ref": "adversarial-review.json",
      "result_digest": "2449fdf6c4239db78d4bcb3dc17b5115a2ef1e28679201c929c77174e10b3ff5",
      "verdict": "PASS",
      "confidence": "high"
    }
  ],
  "required_level": "HUMAN",
  "achieved_level": "ADVERSARIAL",
  "state": "HUMAN_REQUIRED",
  "gate_conclusion": "action_required",
  "escalation_reasons": [
    "ADVERSARIAL:adversarial_protected_path",
    "ADVERSARIAL:governance_change",
    "ADVERSARIAL:protected_path_adversarial_floor",
    "HUMAN:governance_change"
  ],
  "current_head_verified": true,
  "execution_mode": "SHADOW",
  "gate_effective": false,
  "evidence_git_verified": true,
  "evidence_recomputed_verified": true,
  "worktree_clean_verified": true,
  "ledger_anchor_verified": true,
  "cycle_digest": "96b6f2f8625c82774e32b10bdc47ec6f667c221229850c08eb0b406a7ca63d7d"
}
